Title,Author,Date,Push,Not_Push,Comment,Content,Target,Target_name,Target_number,Category,Analysis,Mechanism,Buy_or_sell,Long_or_short,Picture_or_not,Sentiment_score1,Sentiment_score2
[標的] 2344華邦電準備搶反彈,diamonder (diamonder),2018/8/18,29,4,42,1.標的：2344華邦電2.分類：多3.分析/正文：產業前景多空不明，純粹技術分析目前跌幅還未到滿足，個人判斷14.5是關卡一到點穿破拉回進場30%資金，看反彈力道決定是否出場跌破14.5二日未站回馬上停損烙跑出場4.進退場機制：(非長期投資者，必須有停損機制)14.5掛單停利視反彈幅度停損：未站回烙跑,2344華邦電,華邦電,2344,多,產業前景多空不明，純粹技術分析目前跌幅還未到滿足，個人判斷14.5是關卡一到點穿破拉回進場30%資金，看反彈力道決定是否出場跌破14.5二日未站回馬上停損烙跑出場,14.5掛單停利視反彈幅度停損：未站回烙跑,Buy,Short,FALSE,5.927272727,0.305454545
[標的] 加權指數,enail5566 (0.0),2018/8/17,11,5,21,1.標的：加權指數2.分類：多3.分析/正文：下圖為最近一年的加權指數走勢，每每碰到年線都會有平均約600點的反彈目前指數收在年線附近，故估計也會有約600點的反彈https://imgur.com/a/UTsNXYx4.進退場機制：(非長期投資者，必須有停損機制)進場10700停利11300停損10524(前波低點),加權指數,大盤,50,多,下圖為最近一年的加權指數走勢，每每碰到年線都會有平均約600點的反彈目前指數收在年線附近，故估計也會有約600點的反彈https://imgur.com/a/UTsNXYx,進場10700停利11300停損10524(前波低點),Buy,Short,TRUE,0,0
[標的] 5871 中租 空,ZhuBeiCity (Chupei),2018/8/17,15,5,39,1.標的：5871中租2.分類：空3.分析/正文：美中貿易大戰，導致一堆企業已經外移中租最大營收來自中國押寶太重，這次肯定傷很深加上人民幣大貶，業外損失慘重影響毛利外資自營一直跑前天開高尾盤壓低昨天一根大黑棒空頭排列明顯建議長空4.進退場機制：(非長期投資者，必須有停損機制)現空停利70停損105,5871中租,中租-KY,5871,空,美中貿易大戰，導致一堆企業已經外移中租最大營收來自中國押寶太重，這次肯定傷很深加上人民幣大貶，業外損失慘重影響毛利外資自營一直跑前天開高尾盤壓低昨天一根大黑棒空頭排列明顯建議長空,現空停利70停損105,Sell,Short,TRUE,5.965517241,0.206896552
[標的] 智邦2345 多,mafuone5566 (馬芙丸5566),2018/8/17,39,15,66,1.標的：2345智邦多多多2.分類：多3.分析/正文：先上個圖https://i.imgur.com/5DQSHE0.jpg外資Carry完全不怕盤勢震盪的現在這幾次下來整個抗跌還有反彈的趨勢技術面，均線糾結已準備噴發向上現在上車是肉最多的時候4.進退場機制：停利：106元停損1015%（非長期投資者，必須有停損機制)主力繼續嘎空融券空單吧！,2345智邦,智邦,2345,多,先上個圖https://i.imgur.com/5DQSHE0.jpg外資Carry完全不怕盤勢震盪的現在這幾次下來整個抗跌還有反彈的趨勢技術面，均線糾結已準備噴發向上現在上車是肉最多的時候,停利：106元停損1015%（)主力繼續嘎空融券空單吧！,Buy,Short,TRUE,2.311111111,-1.44
[標的] 金像電,eden0417 (俠骨禪心),2018/8/17,39,1,65,1.標的：金像電2.分類：多3.分析/正文：外資和投信狂買，股價還在噴發中！過去營運因NB市場低迷，下修整理了很長的時間。後來營運模式調整，主攻雲端、網通都算是近期題材。有機會在下半年更好！4.進退場機制：(非長期投資者，必須有停損機制)停利：20停損：10老衲昨天入場！阿彌陀佛,金像電,金像電,2368,多,外資和投信狂買，股價還在噴發中！過去營運因NB市場低迷，下修整理了很長的時間。後來營運模式調整，主攻雲端、網通都算是近期題材。有機會在下半年更好！,停利：20停損：10老衲昨天入場！阿彌陀佛,Buy,Short,TRUE,2.125,0.166666667
[標的] 6407 相互 多,HD650 (HD650),2018/8/16,17,0,27,1.標的：6407相互2.分類：多3.分析/正文：基本面：106年H11.66H21.88106年整年EPS0.14元（下半年度轉虧為盈，開始製造華為P20pro軟硬印刷電路板模組全世界第一家三鏡頭供應商高毛利）107年H1EPS2.11元（上半年賺贏去年整年，毛利率、營利率淨利率皆創2014年以來最佳）以過往經歷下半年賺贏上半年（三鏡頭手機越出越多為未來手機標準配備前景看好）預計整年EPS4.5元本益比保守抓15倍預計股價飛到67.5今日收盤均價29.2非常便宜籌碼面：8/14∼10/9買回庫藏股600張（以過往執行率100%）技術面：半年線支撐價位28.77不追高風險小的進場點消息面：興櫃股都沒什麼消息會不會IPO呀？產品面：台灣第一家軟硬複合板https://goo.gl/os7SPp主要客戶：華為、小米、OPPO等大陸手機製鏡頭製造商4.進退場機制：(非長期投資者，必須有停損機制)進場價位現在沒特別因素（大環境）不停損停利67.5,6407相互,相互,6407,多,基本面：106年H11.66H21.88106年整年EPS0.14元（下半年度轉虧為盈，開始製造華為P20pro軟硬印刷電路板模組全世界第一家三鏡頭供應商高毛利）107年H1EPS2.11元（上半年賺贏去年整年，毛利率、營利率淨利率皆創2014年以來最佳）以過往經歷下半年賺贏上半年（三鏡頭手機越出越多為未來手機標準配備前景看好）預計整年EPS4.5元本益比保守抓15倍預計股價飛到67.5今日收盤均價29.2非常便宜籌碼面：8/14∼10/9買回庫藏股600張（以過往執行率100%）技術面：半年線支撐價位28.77不追高風險小的進場點消息面：興櫃股都沒什麼消息會不會IPO呀？產品面：台灣第一家軟硬複合板https://goo.gl/os7SPp主要客戶：華為、小米、OPPO等大陸手機製鏡頭製造商,進場價位現在沒特別因素（大環境）不停損停利67.5,Buy,Long,FALSE,3.472868217,0.939534884
[標的] 3450 聯鈞短多,diva740629 (琳),2018/8/16,9,1,18,1.標的：3450聯鈞2.分類：短多3.分析/正文：先不管基本面~純粹技術面底部放量~進幾張試試~4.進退場機制：進場76~停利84~停損72.5(非長期投資者，必須有停損機制),3450聯鈞,聯鈞,3450,短多,先不管基本面~純粹技術面底部放量~進幾張試試~,進場76~停利84~停損72.5,Buy,Short,FALSE,0,0
[標的] 3037 欣興,nolitchi (()),2018/8/16,18,4,35,1.標的：3037欣興2.分類：多3.分析/正文：籌碼面外資、連買三天融資大減基本面今年7月營收67.86億元，月增12.6%、年增38.3%創下單月及歷史新高，累計前7月營收來到406.52億元，年增19.2%今年首季主要受惠挖礦需求，第二季轉為其他需求，預期第三季FCBG及軟硬結合板需求將更旺。下半年為傳統旺季，不論ABF或BT基材板供需將逐漸吃緊，原第二季已有調漲部分產品線，預期第三季將調漲其他產線，全年展望樂觀。消息面低價PCB股，瑞士信貸狂買，評等20元新聞面《熱門族群》ABF封裝基板喊漲，景碩、南電、欣興樂翻:伺服器及人工智慧相關晶片銷售動能強勁，加上高速網路通訊晶片出貨放量，關鍵的ABF封裝基板需求暢旺。因ABF封裝基板產能過去3年幾乎沒有增加，關鍵的對位用線性滑軌設備交期又長達10個月以上，在年底前無法擴產情況下，包括南電（8046）、欣興（3037）、景碩（3189）的ABF封裝基板已供不應求，最快9月將漲價約1成幅度。4.進退場機制：(非長期投資者，必須有停損機制)進場價位現在停損價位16今天大單敲進，大家快跟上,3037欣興,欣興,3037,多,籌碼面外資、連買三天融資大減基本面今年7月營收67.86億元，月增12.6%、年增38.3%創下單月及歷史新高，累計前7月營收來到406.52億元，年增19.2%今年首季主要受惠挖礦需求，第二季轉為其他需求，預期第三季FCBG及軟硬結合板需求將更旺。下半年為傳統旺季，不論ABF或BT基材板供需將逐漸吃緊，原第二季已有調漲部分產品線，預期第三季將調漲其他產線，全年展望樂觀。消息面低價PCB股，瑞士信貸狂買，評等20元新聞面《熱門族群》ABF封裝基板喊漲，景碩、南電、欣興樂翻:伺服器及人工智慧相關晶片銷售動能強勁，加上高速網路通訊晶片出貨放量，關鍵的ABF封裝基板需求暢旺。因ABF封裝基板產能過去3年幾乎沒有增加，關鍵的對位用線性滑軌設備交期又長達10個月以上，在年底前無法擴產情況下，包括南電（8046）、欣興（3037）、景碩（3189）的ABF封裝基板已供不應求，最快9月將漲價約1成幅度。,進場價位現在停損價位16今天大單敲進，大家快跟上,Buy,Short,FALSE,2.533333333,2.213333333
[標的] 2327國巨2492華新科 (多一天),Ejaculation (小易),2018/8/16,39,14,70,1.標的：232724922.分類：多一天3.分析/正文：散戶已經開始在拉高空被動元件從昨天被動類股的當沖獲利金額就不難看出已經養成習慣了我相信今天大盤走逆勢被動也同樣走逆勢散戶應該空在有點下面可是根本下不去等等越接近收盤他不得不補因為散戶根本沒錢券賣然後還有不死心一直放放到最後一定收最高就是漲停還可能被鎖住買不到哩今天沒漲停最後一盤沖掉漲停明天開高閃4.進退場機制：(非長期投資者，必須有停損機制)648買進國巨265.5買進華新科只要沒漲停尾盤丟掉跌超過十塊盤中直接停損,23272492,東碩,3272,多一天,散戶已經開始在拉高空被動元件從昨天被動類股的當沖獲利金額就不難看出已經養成習慣了我相信今天大盤走逆勢被動也同樣走逆勢散戶應該空在有點下面可是根本下不去等等越接近收盤他不得不補因為散戶根本沒錢券賣然後還有不死心一直放放到最後一定收最高就是漲停還可能被鎖住買不到哩今天沒漲停最後一盤沖掉漲停明天開高閃,648買進國巨265.5買進華新科只要沒漲停尾盤丟掉跌超過十塊盤中直接停損,Buy,Short,FALSE,5.120879121,0.967032967
[標的] 2313 華通 (空),tonyrao (tonyrao),2018/8/15,17,1,28,"1.標的：2313華通2.分類：空3.分析/正文：周線和日線分析有頭部，但目前正要跌破頸線，就等跌破頸線再一根有點帶量的黑K跌破頸線就會是放空的好時機。周MACD柱狀體轉下降，日MACD也正在下降。4.進退場機制：(非長期投資者，必須有停損機制)進場機制：有點帶量的實體黑K跌破頸線價格，此收盤價格約在28.4退場機制：29.3所謂的""偉大的投資人""，其定義是開始了解下檔風險的人SamZell",2313華通,華通,2313,空,周線和日線分析有頭部，但目前正要跌破頸線，就等跌破頸線再一根有點帶量的黑K跌破頸線就會是放空的好時機。周MACD柱狀體轉下降，日MACD也正在下降。,"進場機制：有點帶量的實體黑K跌破頸線價格，此收盤價格約在28.4退場機制：29.3所謂的""偉大的投資人""，其定義是開始了解下檔風險的人SamZell",Sell,Short,FALSE,7.262295082,1.744262295
[標的] 2371 大同 （空）,fluide (阿孟),2018/8/16,16,2,29,1.標的：2371大同2.分類：空空空！3.分析/正文：炒收購題材但股價沒基本面，上半年每股虧損0.94元。技術面也已經均線糾結向下三天無法站回，最近大盤跌股價沒跌只是主力在硬撐拉高慢慢出貨，怕一下跌太多出不了貨，另外公司未來也難有大轉變，補跌機率非常大！4.進退場機制：(非長期投資者，必須有停損機制)反彈就是加碼空，執行深口袋策略，現在股價約38元停損設前波高42元，第一波看30元，長期看回到20元回到炒作前的價格！(風報比約1：4),2371大同,大同,2371,空空空！,炒收購題材但股價沒基本面，上半年每股虧損0.94元。技術面也已經均線糾結向下三天無法站回，最近大盤跌股價沒跌只是主力在硬撐拉高慢慢出貨，怕一下跌太多出不了貨，另外公司未來也難有大轉變，補跌機率非常大！,反彈就是加碼空，執行深口袋策略，現在股價約38元停損設前波高42元，第一波看30元，長期看回到20元回到炒作前的價格！(風報比約1：4),Sell,Long,FALSE,4.148148148,-4.982716049
[標的] 上銀   短空,ich2 (澤尻北川石原都是我老婆),2018/8/15,25,0,34,1.標的：上銀2.分類：短空3.分析/正文：7月中現增價250元太低讓籌碼翻空所有利多消息完全沒用外資投信大賣賣不停借券賣出一直增加融資前兩天減肥500多張太少預計明後天一根長黑殺強迫融資斷頭最低大概會到220元上下融資殺到差不多了才會落底4.進退場機制：今天空260225停利290停損,上銀,上銀,2049,短空,7月中現增價250元太低讓籌碼翻空所有利多消息完全沒用外資投信大賣賣不停借券賣出一直增加融資前兩天減肥500多張太少預計明後天一根長黑殺強迫融資斷頭最低大概會到220元上下融資殺到差不多了才會落底,今天空260225停利290停損,Sell,Short,FALSE,7,-9.876470588
[標的] 4991環宇-KY,MrKing (Mr.King),2018/8/15,6,2,18,1.標的：49912.分類：多3.分析/正文：朋友套很久了，之前一直提醒他KY股不要碰，結果今天自己看到有人發文後竟然直接拉V，我覺得有機會就小進一張希望可以彈一波，我朋友也很看好可以彈這檔有營收獲利也有題材4.進退場機制：前低47停損，上看60SentfromJPTTonmyAsusASUS_Z017DA.,4991,環宇-KY,4991,多,朋友套很久了，之前一直提醒他KY股不要碰，結果今天自己看到有人發文後竟然直接拉V，我覺得有機會就小進一張希望可以彈一波，我朋友也很看好可以彈這檔有營收獲利也有題材,前低47停損，上看60SentfromJPTTonmyAsusASUS_Z017DA.,Buy,Short,FALSE,11.44444444,9.166666667
[標的] 2317鴻海 空，可能引發破底危機！,diamonder (diamonder),2018/8/15,40,6,72,1.標的：2317鴻海2.分類：空3.分析/正文：2317可能會走2337模式，現在是空方狙擊很好的機會，80.2如果破，會一直往下測底部了下面肉很多，是目前空方最安全的資金港避港收盤任何跌破80.2以下價位就空50%資金4.進退場機制：(非長期投資者，必須有停損機制)等待頸線穿破80.2停利9/30停損：連續三日站回80.5,2317鴻海,鴻海,2317,空,2317可能會走2337模式，現在是空方狙擊很好的機會，80.2如果破，會一直往下測底部了下面肉很多，是目前空方最安全的資金港避港收盤任何跌破80.2以下價位就空50%資金,等待頸線穿破80.2停利9/30停損：連續三日站回80.5,Sell,Short,FALSE,3.306122449,2.848979592
[標的] 4541晟田,b8514032 (jimme),2018/8/14,5,0,10,1.標的：晟田（4541）2.分類：多3.分析/正文：（1）107Q1毛利率16.78%EPS0.3元Q2毛利率22.72%EPS0.76元(2)毛利率連四季成長，去年虧損1.19元，今年上半年轉虧為盈1.06元估計全年EPS為1.5~2元。（3）2016年完成第一次擴產，今年預計8月完成2期一廠擴產，主要和漢翔聯合供應CFMLeap引擎機閘，Leap引擎今年開始交貨大幅提升，今年預計交貨1000座，明年估計2000座，今年目前交付進度還落後4到6週，預計下半年拉貨力道更為明顯。https://read01.com/zhtw/LdkakkP.html#.W3LeiugzbIU（相關新聞）（4）若今年廠房順利完工並完成認證，明年度即可提升營收，預估明年Leap引擎若依照進度，再提升一倍之製造，估計明年EPS可達2.5~3元。（5）近期因為現增價28元，市場上賣老股認新股，加上大盤行情有點震盪股價維持在相對歷史低檔區。（6）若下半年和明年度Leap能夠依照順利交貨的話，業績有機會大幅成長，加上股價在低檔區，值得注意。4.進退場機制：停損價25元。,晟田（4541）,晟田,4541,多,（1）107Q1毛利率16.78%EPS0.3元Q2毛利率22.72%EPS0.76元(2)毛利率連四季成長，去年虧損1.19元，今年上半年轉虧為盈1.06元估計全年EPS為1.5~2元。（3）2016年完成第一次擴產，今年預計8月完成2期一廠擴產，主要和漢翔聯合供應CFMLeap引擎機閘，Leap引擎今年開始交貨大幅提升，今年預計交貨1000座，明年估計2000座，今年目前交付進度還落後4到6週，預計下半年拉貨力道更為明顯。https://read01.com/zhtw/LdkakkP.html#.W3LeiugzbIU（相關新聞）（4）若今年廠房順利完工並完成認證，明年度即可提升營收，預估明年Leap引擎若依照進度，再提升一倍之製造，估計明年EPS可達2.5~3元。（5）近期因為現增價28元，市場上賣老股認新股，加上大盤行情有點震盪股價維持在相對歷史低檔區。（6）若下半年和明年度Leap能夠依照順利交貨的話，業績有機會大幅成長，加上股價在低檔區，值得注意。,停損價25元。,Buy,Short,FALSE,8,5.739534884
[標的] 大立光 空,lifebreaker (<U+041B><U+0435><U+043E><U+043D>),2018/8/14,27,3,43,1.標的：大立光2.分類：空3.分析/正文：基本面：不可否認是鏡頭界的霸主然而鏡頭的需求尤其是大立光拿手的分野(塑膠鏡頭)是否仍然需求旺盛是一個問號？至少手機的需求似乎不若往年旺盛以半年報來看相較去年也僅持平以本益比來估算的話現在的股價還是高了些例如以eps200左右來算的話現在是20~25倍本益比需要持續高成長的情況下才撐得住就算業績仍然很好仍然是霸主但沒有持續成長的話勢必會下修殖利率也非常低崩盤時不會有抗跌性的(散戶當然存不起但是對外資而言100張45元股票也是差不多意思)籌碼面：雖然從去年高點回落後再爬回5000高點但外資整體而言還是出脫持股居多減少幅度雖然不是很大但要說再創高(破去年6000高點)我認為是一個負面的效果相反的5000左右見高可能性不小技術面：近日長黑摜破5330又創高留天線很可能是局部高點大盤：世界局勢各種不穩還真的很有崩盤氣氛(當然喊崩盤那麼多反正十年只會中一次)昨日異常減融資我認為是利空對照2月初前幾根大跌融資根本毫無反應就知道散戶沒這種警覺性自己問問身邊同事昨天融資有砍的舉手吧...我寧可解釋成大戶烙跑4.進退場機制：(非長期投資者，必須有停損機制)上週四、五權證進場今日紅盤亦加碼目標：4000以下停損：破前高5330https://i.imgur.com/rRtAzlp.jpg小擼怡情大擼傷身強擼灰飛煙滅,大立光,大立,4716,空,基本面：不可否認是鏡頭界的霸主然而鏡頭的需求尤其是大立光拿手的分野(塑膠鏡頭)是否仍然需求旺盛是一個問號？至少手機的需求似乎不若往年旺盛以半年報來看相較去年也僅持平以本益比來估算的話現在的股價還是高了些例如以eps200左右來算的話現在是20~25倍本益比需要持續高成長的情況下才撐得住就算業績仍然很好仍然是霸主但沒有持續成長的話勢必會下修殖利率也非常低崩盤時不會有抗跌性的(散戶當然存不起但是對外資而言100張45元股票也是差不多意思)籌碼面：雖然從去年高點回落後再爬回5000高點但外資整體而言還是出脫持股居多減少幅度雖然不是很大但要說再創高(破去年6000高點)我認為是一個負面的效果相反的5000左右見高可能性不小技術面：近日長黑摜破5330又創高留天線很可能是局部高點大盤：世界局勢各種不穩還真的很有崩盤氣氛(當然喊崩盤那麼多反正十年只會中一次)昨日異常減融資我認為是利空對照2月初前幾根大跌融資根本毫無反應就知道散戶沒這種警覺性自己問問身邊同事昨天融資有砍的舉手吧...我寧可解釋成大戶烙跑,上週四、五權證進場今日紅盤亦加碼目標：4000以下停損：破前高5330https://i.imgur.com/rRtAzlp.jpg小擼怡情大擼傷身強擼灰飛煙滅,Sell,Short,TRUE,3.846153846,-0.484102564
[標的] 2617 台航,ikj (...),2018/8/14,11,7,22,1.標的：2617台航2.分類：多3.分析/正文：1.波段高點後近日大幅拉回2.7月營收月增年增3.外資持續買進4.本益比偏低4.進退場機制：昨天收盤價18.3目前無出現停損或停利指標打算中長期持有(停損或停利將推文告之)(前一篇標的文南帝尚未賣出),2617台航,台航,2617,多,1.波段高點後近日大幅拉回2.7月營收月增年增3.外資持續買進4.本益比偏低,昨天收盤價18.3目前無出現停損或停利指標打算中長期持有(停損或停利將推文告之)(前一篇標的文南帝尚未賣出),Buy,Long,FALSE,0.87804878,-0.43902439
[標的] 大東1441認列土地,S26 (專做破產轉機借殼掏空股),2018/8/13,11,1,20,1.標的：大東14412.分類：多3.分析/正文：市場總是賤忘的∼∼∼∼∼這檔明明三月就說第二季會認列土地獲利∼∼但除了一個隔日沖美林以外∼∼∼全然沒主力看上這一檔XD∼∼∼目前本益比一倍∼∼∼想像空間大^_^4.進退場機制：上半年賺15元∼∼股價16多∼∼∼視漲停情形賣出∼∼這幾天跌的機率低∼∼∼∼停損設16,大東1441,大東,1441,多,市場總是賤忘的∼∼∼∼∼這檔明明三月就說第二季會認列土地獲利∼∼但除了一個隔日沖美林以外∼∼∼全然沒主力看上這一檔XD∼∼∼目前本益比一倍∼∼∼想像空間大^_^,上半年賺15元∼∼股價16多∼∼∼視漲停情形賣出∼∼這幾天跌的機率低∼∼∼∼停損設16,Buy,Short,FALSE,2.083333333,1.683333333
[標的] 6153 嘉聯益,love27865204 (任),2018/8/13,19,0,28,1.標的：61532.分類：多3.分析/正文：今天表現比大盤強勢很多，線型籌碼都不錯，最壞時代已過4.進退場機制：進場57.4，前波紅k低點停損，先設停損才能進場〔折叔叔有練過，魯魯們不得學〕https://i.imgur.com/K7bbvyi.jpg,6153,嘉聯益,6153,多,今天表現比大盤強勢很多，線型籌碼都不錯，最壞時代已過,進場57.4，前波紅k低點停損，先設停損才能進場〔折叔叔有練過，魯魯們不得學〕https://i.imgur.com/K7bbvyi.jpg,Buy,Short,TRUE,3.75,2.942857143
[標的] 3406 玉晶光 跌停掛價搶反彈,diamonder (diamonder),2018/8/13,12,0,16,1.標的：3406玉晶光2.分類：多3.分析/正文：滿足應該到360362打算今天觸及跌停就進場，破357停損玉晶光滿足點大概到，這隻每年都會財富重分配，今年預估合理價4884.進退場機制：(非長期投資者，必須有停損機制)跌停進場，反彈425先跑一趟357停損,3406玉晶光,玉晶光,3406,多,滿足應該到360362打算今天觸及跌停就進場，破357停損玉晶光滿足點大概到，這隻每年都會財富重分配，今年預估合理價488,跌停進場，反彈425先跑一趟357停損,Buy,Short,FALSE,8.097560976,4.634146341
[標的] 華新科 多 進場抄底或當沖@260,roxiang (請叫我微星哥),2018/8/13,17,15,83,1.標的：華新科24922.分類：多3.分析/正文：今日大盤下殺130點恐慌性賣壓OTC跌破年線多軍完全潰散早盤人踩人賣出爆量你說做多小散戶最近還能賺錢我才不信啦我也賠啊這盤今天要拉就從已經跌他個爽歪歪腰斬的被動才有希望砍成這樣被動融資不斷頭？你不要講什麼被動未來啦我在講今天盤勢再怎麼爛的股到底了還要追空容易被嘎加上今天低檔爆利空新聞(都吵了一個月的話題還又拿出來咧)早盤一次砍6%開盤有點太多了故決定進場抄底因籌碼面不佳這你知我知大家都知加上美股也有回檔風險沒意外今天的操作會今天賣出只求小賺留不留倉我可以明天再決定要不要重新進場4.進退場機制：(非長期投資者，必須有停損機制)https://imgur.com/4ocjnwZ.jpg進場:256退場:今日平盤上找賣點或收盤結清但若大媽盤勢不佳直接退場▄▄▄▄██▄▄▄▄▄▄▄▄▄▄▄▄▄▄▄▄▄▄▄▄▄________▄▄▄▄▄▄▄▄▄▄▄▄█▄（Nintendo）▄▄▄▄▄▄▄▄▄▄▄▄▄￣￣￣￣▄▄▄▄▄▄▄▄▄▄▄▄▄▄,華新科2492,華新科,2492,多,今日大盤下殺130點恐慌性賣壓OTC跌破年線多軍完全潰散早盤人踩人賣出爆量你說做多小散戶最近還能賺錢我才不信啦我也賠啊這盤今天要拉就從已經跌他個爽歪歪腰斬的被動才有希望砍成這樣被動融資不斷頭？你不要講什麼被動未來啦我在講今天盤勢再怎麼爛的股到底了還要追空容易被嘎加上今天低檔爆利空新聞(都吵了一個月的話題還又拿出來咧)早盤一次砍6%開盤有點太多了故決定進場抄底因籌碼面不佳這你知我知大家都知加上美股也有回檔風險沒意外今天的操作會今天賣出只求小賺留不留倉我可以明天再決定要不要重新進場,https://imgur.com/4ocjnwZ.jpg進場:256退場:今日平盤上找賣點或收盤結清但若大媽盤勢不佳直接退場▄▄▄▄██▄▄▄▄▄▄▄▄▄▄▄▄▄▄▄▄▄▄▄▄▄________▄▄▄▄▄▄▄▄▄▄▄▄█▄（Nintendo）▄▄▄▄▄▄▄▄▄▄▄▄▄￣￣￣￣▄▄▄▄▄▄▄▄▄▄▄▄▄▄,Buy,Short,TRUE,9.401639344,-5.26557377
