Title,Author,Date,Push,Not_Push,Comment,Content,Target,Target_name,Target_number,Category,Analysis,Mechanism,Buy_or_sell,Long_or_short,Picture_or_not,Sentiment_score1,Sentiment_score2
[標的] 1617 榮星,chanjay (搶劫),2018/5/29,82,4,116,==============================================================================警告：本標的量非常小，不適合ptt法人進出此為提供個人看法供分享==============================================================================1.標的：1617榮星2.分類：多3.分析/正文：榮星為國內電線電纜大廠，歷史很久很久了，主要大股東為日本古河電工以及大亞，電線電纜線的毛利很低，同時進入障礙很小，在過去可以靠著國家標案(台電)營生，但現在已經完全不行，因此各相關廠商都開始進行不同的發展以求生存，比如大亞切入太陽能發電領域以及風電海底電纜等等。而榮星則加強了與日本古河的合作，取得先進的技術生產消費型電子使用的漆包線，包含智慧音箱的音圈、扁平化節省體積的扁平線等等。目前根據法說會的訊息，榮星利潤、毛利較高的漆包線需求正持續增加，同時技術領先同業約3~5年，發言人是說2015年利基型漆包線銷售50噸，2016年60噸增加的幅度算可觀，同時也出現在毛利率的表現，目前榮星的毛利率約13%~15%，為同業最高。基本面：受惠銅價上漲，加之利基型產品銷售逐漸出量，榮星每月營收已經連續年增20個月左右(扣除農曆年月份)，每季獲利也持續增加，雖然榮星並沒有像大亞一樣擁有大量的低價庫存，但他的營收與獲利卻是實打實的增加。大亞我也曾經買過，當初就是看他擁有大量低價銅庫存，但現在銅價進入了高檔區間震盪，低價的銅庫存應該也消化得差不多了，也因此榮星的庫存控管以及報價規則反而成為了現在我認為有機會的選擇。目前第一季EPS0.15，已經創了3年新高，只要營收持續成長下去，加上匯損因素消失，今年EPS應該有1~1.2的水平。產業面：消費型電子產量持續增加，同時專注於小型化以及硬體密集化，漆包線的用量只會有增無減，比如thunderbolt3目前也從光纖改採銅線，同時Intel已經宣布將thunderbolt3控制內建到CPU內，這個未來也是一個非常大的市場。另外連古河電工都已經在擴展增加包含車用、機械、環保發電等一些特殊用線的產量我個人認為榮星的利基型產品短期內應不虞訂單。技術面：由於基本面的持續改善，直接一波從7元飆漲到17元，目前進行回檔修正，同時也沒有跌破關鍵的頸線，還是在箱型內區間震盪。各種均線都已經糾結排列，下降三角收斂已過表態時間，也是進入了盤整階段。月K線看來會收個小十字，或許是轉折的訊號??因此各指標也都還不差，可以嘗試低接放長。籌碼面：這檔籌碼恐怖....董監大股東持股超過80%，在外流通籌碼量少另外查了一下，今年年初最高點到現在一路跌下來，千張以上的持股竟然還是增加的，籌碼竟然還開始集中，最奇妙的就是大股東大亞這幾個月已經連續在市場賣了500多張，但股價卻還是穩穩的...到底是誰收走的?昨天收盤前，掛買五檔直接出現大量單，這樣的單量在他這種股票出現，很奇怪。另外就是6月底要開股東會，會不會拉個一小波慶祝呢?4.進退場機制：(非長期投資者，必須有停損機制)13.5~13.6進場，不停損先看有沒有機會挑戰壓力線約15.2~15.3左右在看有沒有機會形成月線大底挑戰20<個人覺得蠻難的最後還是要警告：此檔量能相當小，不適合我大PTT法人進出，僅提供個人看法參考,1617榮星,榮星,1617,多,榮星為國內電線電纜大廠，歷史很久很久了，主要大股東為日本古河電工以及大亞，電線電纜線的毛利很低，同時進入障礙很小，在過去可以靠著國家標案(台電)營生，但現在已經完全不行，因此各相關廠商都開始進行不同的發展以求生存，比如大亞切入太陽能發電領域以及風電海底電纜等等。而榮星則加強了與日本古河的合作，取得先進的技術生產消費型電子使用的漆包線，包含智慧音箱的音圈、扁平化節省體積的扁平線等等。目前根據法說會的訊息，榮星利潤、毛利較高的漆包線需求正持續增加，同時技術領先同業約3~5年，發言人是說2015年利基型漆包線銷售50噸，2016年60噸增加的幅度算可觀，同時也出現在毛利率的表現，目前榮星的毛利率約13%~15%，為同業最高。基本面：受惠銅價上漲，加之利基型產品銷售逐漸出量，榮星每月營收已經連續年增20個月左右(扣除農曆年月份)，每季獲利也持續增加，雖然榮星並沒有像大亞一樣擁有大量的低價庫存，但他的營收與獲利卻是實打實的增加。大亞我也曾經買過，當初就是看他擁有大量低價銅庫存，但現在銅價進入了高檔區間震盪，低價的銅庫存應該也消化得差不多了，也因此榮星的庫存控管以及報價規則反而成為了現在我認為有機會的選擇。目前第一季EPS0.15，已經創了3年新高，只要營收持續成長下去，加上匯損因素消失，今年EPS應該有1~1.2的水平。產業面：消費型電子產量持續增加，同時專注於小型化以及硬體密集化，漆包線的用量只會有增無減，比如thunderbolt3目前也從光纖改採銅線，同時Intel已經宣布將thunderbolt3控制內建到CPU內，這個未來也是一個非常大的市場。另外連古河電工都已經在擴展增加包含車用、機械、環保發電等一些特殊用線的產量我個人認為榮星的利基型產品短期內應不虞訂單。技術面：由於基本面的持續改善，直接一波從7元飆漲到17元，目前進行回檔修正，同時也沒有跌破關鍵的頸線，還是在箱型內區間震盪。各種均線都已經糾結排列，下降三角收斂已過表態時間，也是進入了盤整階段。月K線看來會收個小十字，或許是轉折的訊號??因此各指標也都還不差，可以嘗試低接放長。籌碼面：這檔籌碼恐怖....董監大股東持股超過80%，在外流通籌碼量少另外查了一下，今年年初最高點到現在一路跌下來，千張以上的持股竟然還是增加的，籌碼竟然還開始集中，最奇妙的就是大股東大亞這幾個月已經連續在市場賣了500多張，但股價卻還是穩穩的...到底是誰收走的?昨天收盤前，掛買五檔直接出現大量單，這樣的單量在他這種股票出現，很奇怪。另外就是6月底要開股東會，會不會拉個一小波慶祝呢?,13.5~13.6進場，不停損先看有沒有機會挑戰壓力線約15.2~15.3左右在看有沒有機會形成月線大底挑戰20<個人覺得蠻難的最後還是要警告：此檔量能相當小，不適合我大PTT法人進出，僅提供個人看法參考,Buy,Long,FALSE,7.731234867,3.28716707
[標的] 大盤。空,annz (Keep running),2018/5/29,23,11,49,1.標的：大盤2.分類：空3.分析/正文：我覺得我有點反指標每次開盤想做多結果就像今天跳水我是很看好川金會的效應以及台灣年底的選舉行情目前執政黨在雙北、台中都很危險加上友邦斷交所以我認為執政黨在股市上應該會特別關心到年底4.進退場機制：10815停利,大盤,大盤,50,空,我覺得我有點反指標每次開盤想做多結果就像今天跳水我是很看好川金會的效應以及台灣年底的選舉行情目前執政黨在雙北、台中都很危險加上友邦斷交所以我認為執政黨在股市上應該會特別關心到年底,10815停利,Sell,Short,TRUE,5.904761905,-0.742857143
[標的] 2610 華航,WuMOS (Ian),2018/5/29,20,0,24,1.標的：2610華航2.分類：多/空/請益/心得多3.分析/正文：暑假旺季到來KD線觸底向上突破油價開始下跌4.進退場機制：(非長期投資者，必須有停損機制)進場10.15退場11、跌破10元就退,2610華航,華航,2610,多,暑假旺季到來KD線觸底向上突破油價開始下跌,進場10.15退場11、跌破10元就退,Buy,Short,FALSE,4.034482759,-4.220689655
[標的] 00734B 台新JPM新興債 多,Zeal315 (做好每一個細節),2018/5/28,7,0,33,1.標的：00734B台新JPM新興債2.分類：多3.分析/正文：a.籌碼面:低於20元都有大量低接買盤出現b.技術面:海外姊妹ETFEMB已經完成W底，從低位上揚c.新聞面:一堆新興市場負面新聞，反向指標、危機入市d.收益面:收益率5%，比許多股票股利率高e.流動性:目前債券ETF中，流動性最好的一檔4.進退場機制：(非長期投資者，必須有停損機制)a.進場:20元b.停損:無(長期投資)c.停利:21元以上，視情況調整部位,00734B台新JPM新興債,新興,2605,多,a.籌碼面:低於20元都有大量低接買盤出現b.技術面:海外姊妹ETFEMB已經完成W底，從低位上揚c.新聞面:一堆新興市場負面新聞，反向指標、危機入市d.收益面:收益率5%，比許多股票股利率高e.流動性:目前債券ETF中，流動性最好的一檔,a.進場:20元b.停損:無(長期投資)c.停利:21元以上，視情況調整部位,Buy,Long,FALSE,3.46031746,1.282539683
[標的] 6269 台郡,soufon (Google),2018/5/28,22,0,27,"1.標的：台郡2.分類：空3.分析/正文：籌碼面超悲劇,三大法人持續同步賣超消息面蘋概股一整個崩基本面被搶單大盤已高,風險大增,很有機會被大量放空觀察這檔的走勢,完全按照本魯劇本走本魯估計會跌,通常沒有不跌的4.進退場機制：(非長期投資者，必須有停損機制)現價空,停損1.2*現價停利0.8*現價謝謝",台郡,台郡,6269,空,"籌碼面超悲劇,三大法人持續同步賣超消息面蘋概股一整個崩基本面被搶單大盤已高,風險大增,很有機會被大量放空觀察這檔的走勢,完全按照本魯劇本走本魯估計會跌,通常沒有不跌的","現價空,停損1.2*現價停利0.8*現價謝謝",Sell,Short,FALSE,4.138888889,0.033333333
[標的] 5353 台林,iiPhone7 (maktub),2018/5/28,16,0,24,1.標的：5353台林2.分類：看長多3.分析/正文：幾點簡單分析~a.5G概念股現在才15塊https://tw.stock.yahoo.com/q/ta?s=5353b.每股淨值:14.59元很安全c.外資最愛這種虧轉盈個股d.今年1到4月月營收都年增率30%以上e.周、月、季線全部都站上多頭訊號清楚4.進退場機制：(非長期投資者，必須有停損機制)基本面、產業面、技術面都是正向開始試單先上看20站穩20再加碼預計30停利,5353台林,台林,5353,看長多,幾點簡單分析~a.5G概念股現在才15塊https://tw.stock.yahoo.com/q/ta?s=5353b.每股淨值:14.59元很安全c.外資最愛這種虧轉盈個股d.今年1到4月月營收都年增率30%以上e.周、月、季線全部都站上多頭訊號清楚,基本面、產業面、技術面都是正向開始試單先上看20站穩20再加碼預計30停利,Buy,Long,FALSE,3.230769231,3.161538462
[標的] 味全1201 多,houstonm (               ),2018/5/28,6,0,7,1.標的：1201味全多2.分類：多3.分析/正文：https://goo.gl/vSkoSPA)繼統一超處分上海星巴克股份後，將成為台灣少數受惠星巴克中國超過3000間門店數(資料來源:星巴克中國官網)的供應商B)逐漸擺脫2016年營收雙位數衰退，去年微幅增長，2018/4月營收年增達12%，進入旺季業績可望逐月上升C)技術線型今收23.45，站上所有短期均線4.進退場機制：停利先看近期高點25.5，不預設立場停損點5/14長下影線21.75,1201味全多,味全,1201,多,https://goo.gl/vSkoSPA)繼統一超處分上海星巴克股份後，將成為台灣少數受惠星巴克中國超過3000間門店數(資料來源:星巴克中國官網)的供應商B)逐漸擺脫2016年營收雙位數衰退，去年微幅增長，2018/4月營收年增達12%，進入旺季業績可望逐月上升C)技術線型今收23.45，站上所有短期均線,停利先看近期高點25.5，不預設立場停損點5/14長下影線21.75,Buy,Short,FALSE,5.333333333,-0.26031746
[標的] 東生華(8432)空,kksis (流浪人生),2018/5/28,0,0,0,"1.標的：東生華(8432)2.分類：空3.分析/正文：隨著這一波生技股漲一波後，大概這奡N差不多炒完了，沒有實質獲利的公司就是要回歸基本面，而東生華第一季獲利大增主要是權利金轉移入帳大增，股價炒到100後回檔到70,外資每日小賣，股價每日緩跌，未來營收不足以支撐這樣高的股價，大戶套在80以上也想解套，但量縮無法出貨，所以還有大戶的套牢賣壓等著出場。4.進退場機制：空：明日開盤進場空，停損：大戶套牢價格：85停利：50附近。",東生華(8432),東生華,8432,空,"隨著這一波生技股漲一波後，大概這奡N差不多炒完了，沒有實質獲利的公司就是要回歸基本面，而東生華第一季獲利大增主要是權利金轉移入帳大增，股價炒到100後回檔到70,外資每日小賣，股價每日緩跌，未來營收不足以支撐這樣高的股價，大戶套在80以上也想解套，但量縮無法出貨，所以還有大戶的套牢賣壓等著出場。",空：明日開盤進場空，停損：大戶套牢價格：85停利：50附近。,Sell,Short,FALSE,4.98630137,1.287671233
[標的] 臺慶科3357,b8514032 (jimme),2018/5/28,3,0,5,1.標的：臺慶科3357（興櫃）2.分類：多3.分析/正文：不多說就是最熱門的被動元件，最近三年的EPS都有三塊，毛利率和營業利益率連三年走高，營收逐月慢慢走高，在興櫃能見度較低，加上有二次撤回上市申請本益比較低，估今年EPS應該有4至5元，用15倍本益比來估計，至少有60~75元水準，今天在籌碼面上有資金進場，看能不能像奇力新一樣，開始另一波上漲。4.進退場機制：今日進場，平均成本48，停損40元。,臺慶科3357（興櫃）,臺慶科,3357,多,不多說就是最熱門的被動元件，最近三年的EPS都有三塊，毛利率和營業利益率連三年走高，營收逐月慢慢走高，在興櫃能見度較低，加上有二次撤回上市申請本益比較低，估今年EPS應該有4至5元，用15倍本益比來估計，至少有60~75元水準，今天在籌碼面上有資金進場，看能不能像奇力新一樣，開始另一波上漲。,今日進場，平均成本48，停損40元。,Buy,Short,FALSE,2.6875,-0.34375
[標的] 3144 新揚科 ∼ 極短多,annz (Keep running),2018/5/28,6,0,9,1.標的：31442.分類：短多3.分析/正文：1.軟板需求看多2.日本技術3.這波電子股還在漲4.大股東%上揚（參考神秘金字塔）5.PCB族群才開始飆4.進退場機制：短多，32停利,3144,新揚科,3144,短多,1.軟板需求看多2.日本技術3.這波電子股還在漲4.大股東%上揚（參考神秘金字塔）5.PCB族群才開始飆,短多，32停利,Buy,Short,FALSE,0,0
[標的] 2027 大成鋼 空,aeiou6630 (aeiou),2018/5/27,84,15,126,1.標的：2027大成鋼2.分類：空3.分析/正文：一堆利多新聞結果股價一直跌，連日都是開高走低的局勢，籌碼面不好自營商和投信持續賣超，股價繼續往下走機會不小4.進退場機制：進場：32以上停損：35停利：30以下視情況停利,2027大成鋼,大成鋼,2027,空,一堆利多新聞結果股價一直跌，連日都是開高走低的局勢，籌碼面不好自營商和投信持續賣超，股價繼續往下走機會不小,進場：32以上停損：35停利：30以下視情況停利,Sell,Short,FALSE,3.615384615,2.030769231
[標的] 6532 瑞耘 短空,Kalisi (悠遊),2018/5/27,14,0,14,1.標的：6532瑞耘2.分類：短空3.分析/正文：基本面：don’tcare消息面：don’tcare籌碼面：隔日沖美林連買兩日技術面：收盤收在布林通道3.0的上通道外4.進退場機制：(非長期投資者，必須有停損機制)進場：平盤or開高在40左右停利：37停損：漲停已出場https://i.imgur.com/FWRwwZ5.jpg,6532瑞耘,瑞耘,6532,短空,基本面：don’tcare消息面：don’tcare籌碼面：隔日沖美林連買兩日技術面：收盤收在布林通道3.0的上通道外,進場：平盤or開高在40左右停利：37停損：漲停已出場https://i.imgur.com/FWRwwZ5.jpg,Sell,Short,TRUE,0,0
[標的] 2408南亞科(空),ss555136 (凍世),2018/5/28,49,4,84,1.標的：2408南亞科2.分類：短空3.分析/正文：上禮拜五開始員工認股，一直到6/5號結束只要是在增資時在職的員工都有(含作業員)而認股價格為34.3以目前100.5的價格，百分之80一定是認到馬上賣回頭看2016員工認股，股價也是從43>38左右4.進退場機制：(操作至6/8日)120停損100.0進場90.0退場,2408南亞科,南亞科,2408,短空,上禮拜五開始員工認股，一直到6/5號結束只要是在增資時在職的員工都有(含作業員)而認股價格為34.3以目前100.5的價格，百分之80一定是認到馬上賣回頭看2016員工認股，股價也是從43>38左右,(操作至6/8日)120停損100.0進場90.0退場,Sell,Short,TRUE,1.325,-0.99
[標的] 1314中石化（一生一逝）,whiteeasi (Hao),2018/5/26,21,2,40,1.標的：1314中石化2.分類：空3.分析/正文：國際報導：當天收盤時，紐約商品交易所７月交貨的輕質原油期貨價格下跌２．８３美元，收于每桶６７．８８美元，跌幅為４．００％。７月交貨的倫敦布倫特原油期貨價格下跌２．３５美元，收于每桶７６．４４美元，跌幅為２．９８％。爛公司，爛老闆！空爆1314！4.進退場機制：(非長期投資者，必須有停損機制)進場：13.65元停利：8元停損：15元,1314中石化,中石化,1314,空,國際報導：當天收盤時，紐約商品交易所７月交貨的輕質原油期貨價格下跌２．８３美元，收于每桶６７．８８美元，跌幅為４．００％。７月交貨的倫敦布倫特原油期貨價格下跌２．３５美元，收于每桶７６．４４美元，跌幅為２．９８％。爛公司，爛老闆！空爆1314！,進場：13.65元停利：8元停損：15元,Sell,Short,TRUE,5.259259259,-7.62962963
[標的] 3527 聚積 大多頭,pat12345 (咖啡杯),2018/5/26,14,0,24,1.標的：3527聚積2.分類：多3.分析/正文：市場面:打入三星供應鏈，Q2將進入旺季籌碼面:券資比已達30%，且投信外資進十日大量進場，嘎空行情將來臨本益比18，在多頭架構中還有成長空間4.進退場機制：(非長期投資者，必須有停損機制)停利:130停損:100,3527聚積,聚積,3527,多,市場面:打入三星供應鏈，Q2將進入旺季籌碼面:券資比已達30%，且投信外資進十日大量進場，嘎空行情將來臨本益比18，在多頭架構中還有成長空間,停利:130停損:100,Buy,Short,FALSE,2.75,1.59
[標的]  6638 沅聖,irawang (ira),2018/5/25,6,0,10,1.標的：66382.分類：多3.分析/正文：6414旗下ODM廠主要生產智慧居家物流醫療等系統.是目前我看到純度最高的智慧城市相關個股去年EPS超過13配息8.8已經除息且填息了今年業績持續看旺依據6414Q1季報6638Q1獲利大約EPS2.42.5間上半年若營收維持目前水平H1EPS估計56之間沒問題比對去年H1只有3.97成長幅度不小下半年進入旺季且今年有新客戶和新產品量產今年或許有機會賺兩個股本若能追上同集團的64146416的本益比股價上300以上應該不難4.進退場機制：(非長期投資者，必須有停損機制)目前價位均可考慮進場波段投資抱到上櫃通過或是突破300開始往上停利如業績不如預期營收YOY開始衰退則停損停利出場,6638,沅聖,6638,多,6414旗下ODM廠主要生產智慧居家物流醫療等系統.是目前我看到純度最高的智慧城市相關個股去年EPS超過13配息8.8已經除息且填息了今年業績持續看旺依據6414Q1季報6638Q1獲利大約EPS2.42.5間上半年若營收維持目前水平H1EPS估計56之間沒問題比對去年H1只有3.97成長幅度不小下半年進入旺季且今年有新客戶和新產品量產今年或許有機會賺兩個股本若能追上同集團的64146416的本益比股價上300以上應該不難,目前價位均可考慮進場波段投資抱到上櫃通過或是突破300開始往上停利如業績不如預期營收YOY開始衰退則停損停利出場,Buy,Short,FALSE,6.604166667,4.525
[標的] HTC 2498,linces ( MIT I'm comming!),2018/5/26,8,2,14,1.標的：HTCVIVE24982.分類：空3.分析/正文：[新聞]【史上最慘】宏達電去年每股大虧20元[新聞]宏達電股東心碎全年大虧2個股本[新聞]宏達電Q1營收87.9億元只剩顛峰時期6.5%[新聞]好慘！宏達電4月營收21億　創13年多新低近來利空不斷股價也不斷下修今天看到下面這則新聞感覺是繼續往下https://tw.money.yahoo.com/七年跌逾九成空軍捲土重來或預示宏達電股價前景024129594.html4.進退場機制：(非長期投資者，必須有停損機制)59空了2張，50停利，69停損,HTCVIVE2498,宏達電,2498,空,[新聞]【史上最慘】宏達電去年每股大虧20元[新聞]宏達電股東心碎全年大虧2個股本[新聞]宏達電Q1營收87.9億元只剩顛峰時期6.5%[新聞]好慘！宏達電4月營收21億　創13年多新低近來利空不斷股價也不斷下修今天看到下面這則新聞感覺是繼續往下https://tw.money.yahoo.com/七年跌逾九成空軍捲土重來或預示宏達電股價前景024129594.html,59空了2張，50停利，69停損,Sell,Short,FALSE,3.573333333,-4.453333333
[標的] 6237 驊訊 多,the1123 (Jun),2018/5/26,3,0,5,1.標的：6237驊訊2.分類：多3.分析/正文：為國內最大PCI/PCIe/USB音效晶片供應商，暑假即將到來，預計受惠於電競及VR動能持續暢旺，不僅能夠持穩首季營收水準，非常有可能會在更高。今年14月營收年增率分別為153.3%/109.3%/51.6%/82.1%，雖然月增率較不太穩定8.8%/10.1%/6.3%/11.5%，但首季營收1.48億元，年增約96.21%，創歷史新高，EPS0.25轉虧為盈，去年為0.31，基本面應該還算不錯。而在籌碼及技術面的部份，今天被美林沖了一發，直接跌破20日及5日線，但KD及MACD仍未出現死亡交叉，均線還處於糾結持平狀態，並未明顯轉成空頭，自營小買，主力則是無明顯的連續吃貨或出貨現象。小弟第一次po分享標的文，歡迎前輩們指點及一同良性討論！4.進退場機制：(非長期投資者，必須有停損機制)今日尾盤30.85已進2張，奈米對帳單就不好意思貼出來獻醜惹。停損：26，約今年4月最低點停利：40，約35左右會是最大壓力區,6237驊訊,驊訊,6237,多,為國內最大PCI/PCIe/USB音效晶片供應商，暑假即將到來，預計受惠於電競及VR動能持續暢旺，不僅能夠持穩首季營收水準，非常有可能會在更高。今年14月營收年增率分別為153.3%/109.3%/51.6%/82.1%，雖然月增率較不太穩定8.8%/10.1%/6.3%/11.5%，但首季營收1.48億元，年增約96.21%，創歷史新高，EPS0.25轉虧為盈，去年為0.31，基本面應該還算不錯。而在籌碼及技術面的部份，今天被美林沖了一發，直接跌破20日及5日線，但KD及MACD仍未出現死亡交叉，均線還處於糾結持平狀態，並未明顯轉成空頭，自營小買，主力則是無明顯的連續吃貨或出貨現象。小弟第一次po分享標的文，歡迎前輩們指點及一同良性討論！,今日尾盤30.85已進2張，奈米對帳單就不好意思貼出來獻醜惹。停損：26，約今年4月最低點停利：40，約35左右會是最大壓力區,Buy,Short,FALSE,4.838709677,2.767741935
