Title,Author,Date,Push,Not_Push,Comment,Content,Target,Target_name,Target_number,Category,Analysis,Mechanism,Buy_or_sell,Long_or_short,Picture_or_not,Sentiment_score1,Sentiment_score2
[標的] 6111大宇資,eldoncool (股市新手),2018/3/18,16,1,32,1.標的：6111大宇資2.分類：多3.分析/正文：技術面1)從去年7月至今在底部盤整了將近9個月，均線糾結2)前天3/16帶量殺出一根長紅K，布林通道打開可惜收盤試搓前13:24:53硬生生被倒出259張打開漲停...這有點讓人擔憂3)以近半年分價量統計來看，94~95套了8300張，這個價格區間應該會有壓力籌碼面1)外資美林和港商德意志最近兩天大買2)關鍵券商康永哥默默花了四個月買超了三千多張3)令人擔憂的是另一關鍵券商兆豐中壢前天大賣417張回頭看一下明細，兩次漲停鎖住被打開12:18:29內盤成交159張12:24:53內盤成交259張幾乎就等於是兆豐中壢倒出來的張數，算一算手上還有100張還沒賣出總結這支在去年度應該算是蠻有話題性的，應該有很多朋友體驗過山頂的冷...不過以目前的籌碼集中度來說算是蠻優質的但還是有幾個比較需要關注的點1)近期會不會開始有越來越多社團或line群開始講這支，有的話就有機會了2)3/19要觀察一下美林跟兆豐中壢會不會瘋狂倒貨4.進退場機制：(非長期投資者，必須有停損機制)進場:3/16以92元試單買進停損:88元，3/16紅K棒約5%,6111大宇資,大宇資,6111,多,技術面1)從去年7月至今在底部盤整了將近9個月，均線糾結2)前天3/16帶量殺出一根長紅K，布林通道打開可惜收盤試搓前13:24:53硬生生被倒出259張打開漲停...這有點讓人擔憂3)以近半年分價量統計來看，94~95套了8300張，這個價格區間應該會有壓力籌碼面1)外資美林和港商德意志最近兩天大買2)關鍵券商康永哥默默花了四個月買超了三千多張3)令人擔憂的是另一關鍵券商兆豐中壢前天大賣417張回頭看一下明細，兩次漲停鎖住被打開12:18:29內盤成交159張12:24:53內盤成交259張幾乎就等於是兆豐中壢倒出來的張數，算一算手上還有100張還沒賣出總結這支在去年度應該算是蠻有話題性的，應該有很多朋友體驗過山頂的冷...不過以目前的籌碼集中度來說算是蠻優質的但還是有幾個比較需要關注的點1)近期會不會開始有越來越多社團或line群開始講這支，有的話就有機會了2)3/19要觀察一下美林跟兆豐中壢會不會瘋狂倒貨,進場:3/16以92元試單買進停損:88元，3/16紅K棒約5%,Buy,Short,FALSE,5.324675325,-3.223376623
[標的] 6136 富爾特,tagso (白菜一斤多少錢?),2018/3/17,17,4,27,"1.標的：61362.分類：多/空/請益/心得多3.分析/正文：存股界的王牌他喊第一沒人敢喊第二https://tw.stock.yahoo.com/d/s/dividend_6136.html10年配股後成本變負的每年穩定配股利還不時有減資退錢靠大聯大股息過日子大聯大應該還有10年好光景4.進退場機制：(非長期投資者，必須有停損機制)我進場很久了成本是負的如果現在要進場應該還可以過40就請停利正∼面∼能∼量∼(*☉皿☉)/★*""`'*.,_,.*'`""*.,_☆你怕了吧!!!!!",6136,富爾特,6136,多,存股界的王牌他喊第一沒人敢喊第二https://tw.stock.yahoo.com/d/s/dividend_6136.html10年配股後成本變負的每年穩定配股利還不時有減資退錢靠大聯大股息過日子大聯大應該還有10年好光景,"我進場很久了成本是負的如果現在要進場應該還可以過40就請停利正∼面∼能∼量∼(*☉皿☉)/★*""`'*.,_,.*'`""*.,_☆你怕了吧!!!!!",Buy,Short,FALSE,3.4,-0.549090909
[標的] 2534 宏盛 多,ester770815 (玻璃),2018/3/17,31,0,58,1.標的：2534宏盛2.分類：多3.分析/正文：宏盛即將公布股息3月份殖利率超過10%的營建股都還會有一段行情宏盛去年前三季EPS已到3元預估全年EPS約4元~4.5元間歷年分配股息約7成來計算今年約會配2.8元~3.1元間如果公司願意配8成今年約會配3.2元~3.6元間以現金股價29元來算基本上會超過10%何況不只去年好今年獲利入帳更佳受惠於宏2入賬今年至少會有5元EPS以上換句話說保守估計明年至少會配3.5元以上有可能配到4元建議喜歡安全長線穩穩獲利的人買入那怕大盤跌也不用擔心三月底即將公布配息政策到時就可驗證分享個人於27.1進場29.2出場65張約賺12萬獲利先入口袋轉買友達2409友達140張13元賣13.5賺6萬左右因為快到三月底再轉入宏盛29.366張短期目標價32元長線目標價40元以上(這個價可能要放到明年二月~三月這時候)4.進退場機制：(非長期投資者，必須有停損機制)停利32元以上視情況不停損,2534宏盛,宏盛,2534,多,宏盛即將公布股息3月份殖利率超過10%的營建股都還會有一段行情宏盛去年前三季EPS已到3元預估全年EPS約4元~4.5元間歷年分配股息約7成來計算今年約會配2.8元~3.1元間如果公司願意配8成今年約會配3.2元~3.6元間以現金股價29元來算基本上會超過10%何況不只去年好今年獲利入帳更佳受惠於宏2入賬今年至少會有5元EPS以上換句話說保守估計明年至少會配3.5元以上有可能配到4元建議喜歡安全長線穩穩獲利的人買入那怕大盤跌也不用擔心三月底即將公布配息政策到時就可驗證分享個人於27.1進場29.2出場65張約賺12萬獲利先入口袋轉買友達2409友達140張13元賣13.5賺6萬左右因為快到三月底再轉入宏盛29.366張短期目標價32元長線目標價40元以上(這個價可能要放到明年二月~三月這時候),停利32元以上視情況不停損,Buy,Long,FALSE,5.125,3.983333333
[標的] 東元1504 空,Dickman (屌面俠),2018/3/16,5,0,11,1.標的：1504東元2.分類：多/空/請益/心得空3.分析/正文：各位版友好，股市新手誠心討論，還望版友手下留情正文：空的理由只有一個，外資大賣8000張...我認為光是這個理由就很充足了外資不可能沒事賣這麼多，絕對是有內線消息事實上今天的尾盤爆量，有些個股已經事後反應出來了(例如8112)其他個股在消息尚未公布出來以前跟著爆量趨勢做多或做空，勝率應該很大其實我手上有一張買在25.2如果禮拜一有幸還沒公布利空消息，不管是賺是賠我都要賣掉了4.進退場機制：(非長期投資者，必須有停損機制)進場：反彈皆空點停利：20停損：27不想空這隻的話，也可以找找尾盤大買的股票去做多像是5371，拉回皆買,1504東元,東元,1504,空,各位版友好，股市新手誠心討論，還望版友手下留情正文：空的理由只有一個，外資大賣8000張...我認為光是這個理由就很充足了外資不可能沒事賣這麼多，絕對是有內線消息事實上今天的尾盤爆量，有些個股已經事後反應出來了(例如8112)其他個股在消息尚未公布出來以前跟著爆量趨勢做多或做空，勝率應該很大其實我手上有一張買在25.2如果禮拜一有幸還沒公布利空消息，不管是賺是賠我都要賣掉了,進場：反彈皆空點停利：20停損：27不想空這隻的話，也可以找找尾盤大買的股票去做多像是5371，拉回皆買,Sell,Short,FALSE,4.276595745,0.421276596
[標的] 6180橘子 空,abiggun (大支),2018/3/16,22,0,32,1.標的：橘子61802.分類：空3.分析/正文：（1）過年行情+寒假行情+遊戲股行情已過雖連續三個月營收創新高，但已過遊戲股最高峰的過年寒假行情，2月營收也沒有特別突出之表現，許多課長已經推坑，接下來營收只會一路向下到年底。（2）去年轉虧為盈股利發放0.5塊雖然去年成功轉虧為盈，但橘子體質不好是事實，全年EPS也才0.17，本益比高達450倍，有天M這個史詩IP卻只是要炒短線、炒作股價，許多課長退出，接下來2018能不能賺錢還有得拼，2017股利發放0.5塊，依現在股價推算殖利率0.6%比定存還爛。（3）今日主力敲進1500張外資300張主力外資有這麼好心幫散戶解套？他們只是要幫自己解套，留長上引K線就知道上方壓力有多大，先誘多再全部倒給追高散戶。（4）資券比21%借券賣剩3694張融券在跌至70時已陸續回補，已無法造成嘎空行情，跟著主力一起空回30，睡醒買房。（5）多軍信仰不足像我就是停損多軍，就算要拉，套在上面的慘戶也會想趕快出掉拿回資金，壓力太大，誰要接這個刀？上次跟大家作對，拉上去隔天主力就全倒出來，選擇做多賠了快十萬停損，這次決定跟著浪頭走，睡醒數錢。若有分析不妥的地方，還請各位多多指教，理性討論。4.進退場機制：(非長期投資者，必須有停損機制)禮拜ㄧ開盤掛現價賣出停損88停利30,橘子6180,橘子,6180,空,（1）過年行情+寒假行情+遊戲股行情已過雖連續三個月營收創新高，但已過遊戲股最高峰的過年寒假行情，2月營收也沒有特別突出之表現，許多課長已經推坑，接下來營收只會一路向下到年底。（2）去年轉虧為盈股利發放0.5塊雖然去年成功轉虧為盈，但橘子體質不好是事實，全年EPS也才0.17，本益比高達450倍，有天M這個史詩IP卻只是要炒短線、炒作股價，許多課長退出，接下來2018能不能賺錢還有得拼，2017股利發放0.5塊，依現在股價推算殖利率0.6%比定存還爛。（3）今日主力敲進1500張外資300張主力外資有這麼好心幫散戶解套？他們只是要幫自己解套，留長上引K線就知道上方壓力有多大，先誘多再全部倒給追高散戶。（4）資券比21%借券賣剩3694張融券在跌至70時已陸續回補，已無法造成嘎空行情，跟著主力一起空回30，睡醒買房。（5）多軍信仰不足像我就是停損多軍，就算要拉，套在上面的慘戶也會想趕快出掉拿回資金，壓力太大，誰要接這個刀？上次跟大家作對，拉上去隔天主力就全倒出來，選擇做多賠了快十萬停損，這次決定跟著浪頭走，睡醒數錢。若有分析不妥的地方，還請各位多多指教，理性討論。,禮拜ㄧ開盤掛現價賣出停損88停利30,Sell,Short,FALSE,6.906976744,0.344186047
[標的] 緯創 3231 短空,rayterzll (CH012534),2018/3/16,11,0,21,1.標的：緯創32312.分類：短空3.分析/正文：借券異常大增，外資連三天借券賣出今天早上聽聞在緯創上班的朋友講偷換料事件好像懲處名單已確定(代表真有偷換???)縱使沒有停工但聲譽短期內還是有衝擊而且本來大買緯創好幾天的大摩今天都開始大賣且今日也大量又收低近期震盪難以避免但殖利率多多少少還是有支撐故目標回補價格在24左右小賺便當錢4.進退場機制：(非長期投資者，必須有停損機制)早盤聽聞朋友消息後已小空5張25.9停損:27元停利:24元,緯創3231,緯創,3231,短空,借券異常大增，外資連三天借券賣出今天早上聽聞在緯創上班的朋友講偷換料事件好像懲處名單已確定(代表真有偷換???)縱使沒有停工但聲譽短期內還是有衝擊而且本來大買緯創好幾天的大摩今天都開始大賣且今日也大量又收低近期震盪難以避免但殖利率多多少少還是有支撐故目標回補價格在24左右小賺便當錢,早盤聽聞朋友消息後已小空5張25.9停損:27元停利:24元,Sell,Short,FALSE,7.532467532,-0.358441558
[標的] 2888 新光金 空,supermanrs (好傻好天真),2018/3/16,9,1,20,1.標的：新光金28882.分類：空3.分析/正文：1.珠珠姊如同長林王一樣，被利用完之後就被冷凍，明升暗降，表面上是掌管未來營運策略的副董(託孤大臣)，但最終還是親血脈重於績效經理人。2.剛上任的黃總經理看到一邊是被冷凍的珠珠姊，一邊是如日中天的長公主，該效命於誰就不用說了，珠珠姊已無舞台。3.新光金內鬥再起，星期一開始連續跌停無誤，美林這半年買進的20萬張倒好倒滿。4.進退場機制：(非長期投資者，必須有停損機制)星期一開始空停利:6.9元停損:16.9元另一個停利機制是珠珠姊宣布從新光金離開，請自行掌握。,新光金2888,新光金,2888,空,1.珠珠姊如同長林王一樣，被利用完之後就被冷凍，明升暗降，表面上是掌管未來營運策略的副董(託孤大臣)，但最終還是親血脈重於績效經理人。2.剛上任的黃總經理看到一邊是被冷凍的珠珠姊，一邊是如日中天的長公主，該效命於誰就不用說了，珠珠姊已無舞台。3.新光金內鬥再起，星期一開始連續跌停無誤，美林這半年買進的20萬張倒好倒滿。,星期一開始空停利:6.9元停損:16.9元另一個停利機制是珠珠姊宣布從新光金離開，請自行掌握。,Sell,Short,FALSE,3.639534884,-0.388372093
[標的] 新光金 2888 多,abker123 (  ),2018/3/16,39,5,71,1.標的：新光金2.分類：多3.分析/正文：新光銀行我常去櫃姐超級正比小辣椒還辣顧得好門面生意自然好生意好營收就好珠珠姐被拔利空出盡4.進退場機制：超長期投資不停損停利上看追國泰金,新光金,新光金,2888,多,新光銀行我常去櫃姐超級正比小辣椒還辣顧得好門面生意自然好生意好營收就好珠珠姐被拔利空出盡,超長期投資不停損停利上看追國泰金,Buy,Long,FALSE,1.090909091,0.206060606
[標的] 恩德 1528 (空),stockdog (股海中的一條狗),2018/3/16,8,6,20,1.標的：1528恩德2.分類：多/空/請益/心得空3.分析/正文：31:3/12新聞出來爆大量留上影線，當日成交量24753張32:投顧劉彥良3/14喊進，經觀察有一家主力成本均價14.X塊，已經先溜了33:這5日線型都是留上影線，17.2塊壓力很大，根本就上不去34:今天開高，但往下走，是個非常好的空點。4.進退場機制：(非長期投資者，必須有停損機制)停損:18塊,1528恩德,恩德,1528,空,31:3/12新聞出來爆大量留上影線，當日成交量24753張32:投顧劉彥良3/14喊進，經觀察有一家主力成本均價14.X塊，已經先溜了33:這5日線型都是留上影線，17.2塊壓力很大，根本就上不去34:今天開高，但往下走，是個非常好的空點。,停損:18塊,Sell,Short,TRUE,2.961538462,-1.846153846
[標的] 巨路 6192 多,kivenQQ (阿里山的美日出),2018/3/16,7,1,12,1.標的：6192巨路2.分類：多/空/請益/心得多3.分析/正文：基本面目前本益比12.94受惠於EMERSON購併PENTAIR閥門部門業務量增加2017/11月開始營收年增率轉正上升中油第三天然氣接收站預計今年動工為彌補電力缺口近年陸續有電廠改善及新建工程技術面量縮盤整外資法人近日連續買超籌碼面千張以上大戶上升中總股東人數連續半年下降消息面2017/12月海外子公司轉入現金股利3000萬美元預計反映在年報和第四季財報上4.進退場機制：(非長期投資者，必須有停損機制)58元進場跌破55元支撐停損,6192巨路,巨路,6192,多,基本面目前本益比12.94受惠於EMERSON購併PENTAIR閥門部門業務量增加2017/11月開始營收年增率轉正上升中油第三天然氣接收站預計今年動工為彌補電力缺口近年陸續有電廠改善及新建工程技術面量縮盤整外資法人近日連續買超籌碼面千張以上大戶上升中總股東人數連續半年下降消息面2017/12月海外子公司轉入現金股利3000萬美元預計反映在年報和第四季財報上,58元進場跌破55元支撐停損,Buy,Short,FALSE,4.071428571,2.361904762
[標的] 2464 盟立,ppcity (),2018/3/16,22,0,34,1.標的：2464盟立2.分類：多3.分析/正文：a.在手訂單百億以上，訂單已經看到2年後了，預估上半年會認列7成左右，後面每個月年增率預估都將達40%以上。b.安川去年擴產，代理商盟立將直接受惠，盟立本身的大陸廠也開始貢獻營收。c.近期外資投信皆站在賣方，但投信持股已剩下不到1%，下檔空間有限。4.進退場機制：(非長期投資者，必須有停損機制)47以下已進場，43以下停損預估3月底前公布年報到4月中大戶法人會有一波認錯行情。惟不知預收的美元貨款還有美元資產還剩多少，這些直接會影響Q1財報數字。但機器人產業長期看多。,2464盟立,盟立,2464,多,a.在手訂單百億以上，訂單已經看到2年後了，預估上半年會認列7成左右，後面每個月年增率預估都將達40%以上。b.安川去年擴產，代理商盟立將直接受惠，盟立本身的大陸廠也開始貢獻營收。c.近期外資投信皆站在賣方，但投信持股已剩下不到1%，下檔空間有限。,47以下已進場，43以下停損預估3月底前公布年報到4月中大戶法人會有一波認錯行情。惟不知預收的美元貨款還有美元資產還剩多少，這些直接會影響Q1財報數字。但機器人產業長期看多。,Buy,Long,FALSE,2.033333333,2.582222222
[標的] 4746台耀,benq5566 (廢文專用),2018/3/16,9,1,16,1.標的：4746台耀2.分類：多3.分析/正文：破底翻，股價帶量突破均線。去年受匯率、缺料及維他命D衍生物成長不如預期影響。但法人預估3月營收有機會回升至2.5億元之上，不排除挑戰3億元創近期新高。4.進退場機制：短線60再洗盤幫我抬轎挑戰70看8052停損,4746台耀,台耀,4746,多,破底翻，股價帶量突破均線。去年受匯率、缺料及維他命D衍生物成長不如預期影響。但法人預估3月營收有機會回升至2.5億元之上，不排除挑戰3億元創近期新高。,短線60再洗盤幫我抬轎挑戰70看8052停損,Buy,Short,FALSE,7.952380952,6.361904762
[標的] 6116彩晶(做多),lelena (Jessica),2018/3/15,10,4,21,1.標的：6116彩晶2.分類：多3.分析/正文：基本面:TFTLCD液晶99.02%、其他0.98%(2016年)技術面:連長2天大紅棒消息面:彩晶(6116)2月營收11億3653萬元，月增率40.98%，年增率41.84%營收衰退還能大漲~送分題4.進退場機制：(非長期投資者，必須有停損機制)進場10.6(+0.2)停損9.9停利14,6116彩晶,彩晶,6116,多,基本面:TFTLCD液晶99.02%、其他0.98%(2016年)技術面:連長2天大紅棒消息面:彩晶(6116)2月營收11億3653萬元，月增率40.98%，年增率41.84%營收衰退還能大漲~送分題,進場10.6(+0.2)停損9.9停利14,Buy,Short,TRUE,3.789473684,0.378947368
[標的] 6609瀧澤科(多),bigbear00783 (cinghsang),2018/3/15,21,1,43,1.標的：6609瀧澤科2.分類：多3.分析/正文：31.技術線型短線好，KD指標黃金交叉往上32.營收不錯，後勢有漸入佳境之態33.近年預計配股配息34.以投機心態看，量少!有心人如果意願炒，短線容易上噴(也有機會下噴)4.進退場機制：進場35.30停損上下10%,6609瀧澤科,瀧澤科,6609,多,31.技術線型短線好，KD指標黃金交叉往上32.營收不錯，後勢有漸入佳境之態33.近年預計配股配息34.以投機心態看，量少!有心人如果意願炒，短線容易上噴(也有機會下噴),進場35.30停損上下10%,Buy,Short,FALSE,8.941176471,2.611764706
[標的] 3006,LiFePO4 (磷酸鋰鐵),2018/3/15,12,0,21,1.標的：30062.分類：多3.分析/正文：（1）1GDDR3客規品（毛利率高）（2）Android手機記憶體市佔高（上半年Android旗艦機接踵而來）(3)今日技術面帶量突破48.24.進退場機制：停損46我不推沒量的股票啊！￣￣￣￣￣￣￣￣￣￣￣￣￣￣￣￣￣￣￣￣￣￣￣￣￣￣￣￣￣￣￣￣￣￣￣￣￣￣￣A￣￣￣￣￣￣￣￣￣￣￣￣￣￣￣￣￣￣￣￣￣￣￣￣￣￣￣￣￣￣￣￣￣￣￣￣￣￣r￣￣￣￣￣￣￣￣￣￣￣￣￣￣￣￣￣￣￣￣￣￣￣￣￣￣￣￣￣￣￣￣￣￣￣￣￣m￣￣￣￣￣￣￣￣￣￣￣￣￣￣￣￣￣￣￣￣￣￣￣￣￣￣￣￣￣￣￣￣￣￣￣￣￣o￣￣￣￣￣￣￣￣￣￣￣￣￣￣￣￣￣￣￣￣￣￣￣￣￣￣￣￣￣￣￣￣￣￣￣￣￣u￣￣￣￣￣￣￣￣￣￣￣￣￣￣￣￣￣￣￣￣￣￣￣￣￣￣￣￣￣￣￣￣￣￣￣￣￣r,3006,晶豪科,3006,多,（1）1GDDR3客規品（毛利率高）（2）Android手機記憶體市佔高（上半年Android旗艦機接踵而來）(3)今日技術面帶量突破48.2,停損46我不推沒量的股票啊！￣￣￣￣￣￣￣￣￣￣￣￣￣￣￣￣￣￣￣￣￣￣￣￣￣￣￣￣￣￣￣￣￣￣￣￣￣￣￣A￣￣￣￣￣￣￣￣￣￣￣￣￣￣￣￣￣￣￣￣￣￣￣￣￣￣￣￣￣￣￣￣￣￣￣￣￣￣r￣￣￣￣￣￣￣￣￣￣￣￣￣￣￣￣￣￣￣￣￣￣￣￣￣￣￣￣￣￣￣￣￣￣￣￣￣m￣￣￣￣￣￣￣￣￣￣￣￣￣￣￣￣￣￣￣￣￣￣￣￣￣￣￣￣￣￣￣￣￣￣￣￣￣o￣￣￣￣￣￣￣￣￣￣￣￣￣￣￣￣￣￣￣￣￣￣￣￣￣￣￣￣￣￣￣￣￣￣￣￣￣u￣￣￣￣￣￣￣￣￣￣￣￣￣￣￣￣￣￣￣￣￣￣￣￣￣￣￣￣￣￣￣￣￣￣￣￣￣r,Buy,Short,FALSE,0,0
[標的] 大同2371(多),sondscool (亞克夫),2018/3/15,8,0,20,1.標的：2371大同2.分類：短多3.分析/正文：觀察觸底多天仍跌不下去，目前帶量反彈。有反彈跡象。在這幾天低價已少量買進。預估今天籌碼外資回頭，低價股低價仍是買點。融資大減也是一個看點。4.進退場機制：(非長期投資者，必須有停損機制)24.5停利21停損,2371大同,大同,2371,短多,觀察觸底多天仍跌不下去，目前帶量反彈。有反彈跡象。在這幾天低價已少量買進。預估今天籌碼外資回頭，低價股低價仍是買點。融資大減也是一個看點。,24.5停利21停損,Buy,Short,FALSE,4,-3.541463415
[標的] 3045台灣大,meRscliche (如此而已),2018/3/14,6,1,12,1.標的：3045台灣大2.分類：多3.分析/正文：(1)大盤上行，類債券的電信股向下，目前不錯低(2)台灣央行利率凍漲，並據傳將用升值取代升息，利於電信股價格(3)4904遠傳也同理，遠傳波動較台灣大還大，風險高一點但肉也較多4.進退場機制：(非長期投資者，必須有停損機制)今日已進場一張106。第一次賣點在除權息前，如遇上大盤回測低點，電信股價過高可提前賣出。停損的話……如果虧損的話，一樣擺到除權息前賣。,3045台灣大,台灣大,3045,多,(1)大盤上行，類債券的電信股向下，目前不錯低(2)台灣央行利率凍漲，並據傳將用升值取代升息，利於電信股價格(3)4904遠傳也同理，遠傳波動較台灣大還大，風險高一點但肉也較多,今日已進場一張106。第一次賣點在除權息前，如遇上大盤回測低點，電信股價過高可提前賣出。停損的話……如果虧損的話，一樣擺到除權息前賣。,Buy,Short,FALSE,3.089552239,-1.797014925
[標的] 2612 中航,qscft (qscft),2018/3/14,0,1,4,1.標的：2612中航2.分類：多3.分析/正文：技術面：震盪幅度越來越小，今日量明顯比前幾日大，且突破小區間籌碼面：上次高點於12/4突破失敗後，繼續整理並且整理期間，大戶持股慢慢上升https://i.imgur.com/Fm4W9aT.png基本面：去年因認損台航，導致虧損，預計今年能轉虧為盈其他：題材為原物料需求，但BDI和BCI指數滑落，近期表現不佳，恐怕沒有燃點可以炒作4.進退場機制：(非長期投資者，必須有停損機制)今日30.9試單進場停損設8%：28.45出場一個月後盈虧沒超過0%，強制出場，重新評估,2612中航,中航,2612,多,技術面：震盪幅度越來越小，今日量明顯比前幾日大，且突破小區間籌碼面：上次高點於12/4突破失敗後，繼續整理並且整理期間，大戶持股慢慢上升https://i.imgur.com/Fm4W9aT.png基本面：去年因認損台航，導致虧損，預計今年能轉虧為盈其他：題材為原物料需求，但BDI和BCI指數滑落，近期表現不佳，恐怕沒有燃點可以炒作,今日30.9試單進場停損設8%：28.45出場一個月後盈虧沒超過0%，強制出場，重新評估,Buy,Short,TRUE,6.794520548,-6.493150685
[標的] 3029零壹(做多),lelena (Jessica),2018/3/14,10,4,24,1.標的：3029零壹2.分類：多3.分析/正文：基本面:雲端AI技術面:往上爬消息面:零壹訂6/11召開股東常會4.進退場機制：(非長期投資者，必須有停損機制)進場23.4(+0.4)停損21.5停利28,3029零壹,零壹,3029,多,基本面:雲端AI技術面:往上爬消息面:零壹訂6/11召開股東常會,進場23.4(+0.4)停損21.5停利28,Buy,Short,FALSE,0,0
